{
  "edition": "2026-10-22-am",
  "date": "2026-10-22",
  "updated_at": "2026-10-22T07:00:00-04:00",
  "lead": "no-ties",
  "stories": [
    {
      "slug": "no-ties",
      "date": "2026-10-21",
      "section": "fake",
      "kicker": "MICHIGAN",
      "headline": "No Ties? His Half-Sister: “My Family Has Long Been MB.”",
      "deck": "El-Sayed told NBC “We have no ties” and called the proof “hearsay evidence from a tweet.” His half-sister’s posts are still up.",
      "byline": "By FNN Desk",
      "body": "Oct. 11, Meet the Press: asked whether he or his family has Muslim Brotherhood ties, Michigan’s Democratic Senate nominee said, “No.”\n\nOct. 14, NBC: “I have no ties. We have no ties.” The proof, he said, was “hearsay evidence from a tweet.”\n\nThe “tweet” is at least eight 2012–2013 posts by his half-sister, Eman Abdelhadi. Same mother. All still up.\n\nOct. 21, the debate: “an organization I’ve never been a part of, because my mom, who’s a nurse in Missouri?”\n\nIn 2012 he signed a letter urging President Morsi to “purge the media and the police.”\n\nNo ties. Just family.",
      "pull_quote": "From “we have no ties” to “I’ve never been a part of” in ten days.",
      "then": {
        "text": "My family has long been MB, but I’ve always felt that it has navigated the political sphere poorly/destructively.",
        "date": "2012-06-24",
        "source": "https://x.com/emanabdelhadi/status/216974809626710016",
        "source_name": "her own post on X",
        "who": "Eman Abdelhadi, his half-sister"
      },
      "now": {
        "text": "I have no ties. We have no ties.",
        "date": "2026-10-14",
        "source": "https://freebeacon.com/democrats/hearsay-abdul-el-sayed-dismisses-sisters-claims-about-familys-muslim-brotherhood-activism/",
        "source_name": "Washington Free Beacon, NBC interview with Tom Llamas",
        "who": "Abdul El-Sayed, Democratic Senate nominee, Michigan"
      },
      "record": [
        {
          "date": "2012-06-24",
          "label": "Abdelhadi: “My family has long been MB”",
          "source": "X",
          "url": "https://x.com/emanabdelhadi/status/216974809626710016",
          "role": "then"
        },
        {
          "date": "2026-10-14",
          "label": "El-Sayed to NBC’s Tom Llamas: “We have no ties,” “hearsay evidence from a tweet”",
          "source": "Washington Free Beacon",
          "url": "https://freebeacon.com/democrats/hearsay-abdul-el-sayed-dismisses-sisters-claims-about-familys-muslim-brotherhood-activism/",
          "role": "now"
        },
        {
          "date": "2004-10-13",
          "label": "Treasury designates the worldwide IARA network",
          "source": "U.S. Treasury",
          "url": "https://home.treasury.gov/news/press-releases/js2025",
          "role": null
        },
        {
          "date": "2012-06-24",
          "label": "Abdelhadi: their mother’s “activism in the Muslim Brotherhood during the early 70s”",
          "source": "X",
          "url": "https://x.com/emanabdelhadi/status/216967370747551744",
          "role": null
        },
        {
          "date": "2012-06-24",
          "label": "Abdelhadi: “Asked my Aunt about the MB”",
          "source": "X",
          "url": "https://x.com/emanabdelhadi/status/216911228176576513",
          "role": null
        },
        {
          "date": "2012-11-25",
          "label": "Al-Ahram letter to President Morsi, “purge the media and the police”; signer No. 33",
          "source": "Al-Ahram Gate (Wayback, Arabic)",
          "url": "https://web.archive.org/web/20260909132033/https://gate.ahram.org.eg/News/276648.aspx",
          "role": null
        },
        {
          "date": "2012-12-06",
          "label": "Abdelhadi: “family who support the ikhwan”",
          "source": "X",
          "url": "https://x.com/emanabdelhadi/status/276852616783360000",
          "role": null
        },
        {
          "date": "2013-07-03",
          "label": "Abdelhadi: “family jailed for being a part of it”",
          "source": "X",
          "url": "https://x.com/emanabdelhadi/status/352466691256623104",
          "role": null
        },
        {
          "date": "2013-07-03",
          "label": "Abdelhadi: “#MB family in #Egypt has been saying the same thing”",
          "source": "X",
          "url": "https://x.com/emanabdelhadi/status/352498191926702080",
          "role": null
        },
        {
          "date": "2013-07-03",
          "label": "Abdelhadi: “Praying for all my family that supports the #MB in #Egypt”",
          "source": "X",
          "url": "https://x.com/emanabdelhadi/status/352513610104324096",
          "role": null
        },
        {
          "date": "2013-07-05",
          "label": "Abdelhadi: “it’s not over”",
          "source": "X",
          "url": "https://x.com/emanabdelhadi/status/353199089497808898",
          "role": null
        },
        {
          "date": "2017-07-19",
          "label": "Abdelhadi: “proud of my big brother!”",
          "source": "X",
          "url": "https://x.com/emanabdelhadi/status/887686904971485184",
          "role": null
        },
        {
          "date": "2025-04-17",
          "label": "Abdelhadi: “I am a proud little sister”",
          "source": "X",
          "url": "https://x.com/emanabdelhadi/status/1912864138058948608",
          "role": null
        },
        {
          "date": "2026-08-25",
          "label": "His mother worked for IARA-USA; “never charged with anything”",
          "source": "Snopes",
          "url": "https://www.snopes.com/news/2026/08/25/el-sayed-mother-charity-terrorism/",
          "role": null
        },
        {
          "date": "2026-10-11",
          "label": "Meet the Press: Welker asks about ties for him or his family; “No.”",
          "source": "NBC News",
          "url": "https://www.nbcnews.com/meet-the-press/video/oct-11-abdul-el-sayed-sen-thom-tillis-and-michael-lewis-271410757557",
          "role": null
        },
        {
          "date": "2026-10-15",
          "label": "El-Sayed again denies ties; “his half sister”",
          "source": "Washington Post",
          "url": "https://www.washingtonpost.com/politics/2026/10/15/el-sayed-again-denies-ties-muslim-brotherhood/",
          "role": null
        },
        {
          "date": "2026-10-15",
          "label": "Free Beacon posts the Llamas clip",
          "source": "Washington Free Beacon on X",
          "url": "https://x.com/FreeBeacon/status/2110723033165869468",
          "role": null
        },
        {
          "date": "2026-10-19",
          "label": "Oct. 14 NBC quotes; same mother; “El-Sayed also signed a 2012 statement”",
          "source": "PolitiFact",
          "url": "https://www.politifact.com/factchecks/2026/oct/19/mike-rogers/el-sayed-muslim-brotherhood-michigan-senate/",
          "role": null
        },
        {
          "date": "2026-10-19",
          "label": "“signed an open letter supporting then-Egyptian President Mohamed Morsi”",
          "source": "CNN",
          "url": "https://www.cnn.com/2026/10/19/politics/abdul-el-sayed-muslim-brotherhood-michigan-senate-race",
          "role": null
        },
        {
          "date": "2026-10-21",
          "label": "WXYZ debate: “because my mom, who’s a nurse in Missouri?”",
          "source": "CBS News",
          "url": "https://www.cbsnews.com/news/final-michigan-senate-debate-abdul-el-sayed-mike-rogers/",
          "role": null
        },
        {
          "date": "2026-10-21",
          "label": "WXYZ debate, full video (about 30:26)",
          "source": "YouTube",
          "url": "https://www.youtube.com/watch?v=82Q7rikz9q4",
          "role": null
        },
        {
          "date": "2026-10-21",
          "label": "Rogers and El-Sayed clash at second debate",
          "source": "Michigan Advance",
          "url": "https://michiganadvance.com/2026/10/21/rogers-el-sayed-clash-over-iran-healthcare-and-muslim-brotherhood-during-second-debate/",
          "role": null
        }
      ],
      "image": {
        "alt": "Abdul El-Sayed, Michigan’s Democratic Senate nominee",
        "credit": "FNN"
      },
      "share": {
        "line": "El-Sayed: “We have no ties.” His half-sister, 2012: “My family has long been MB.” The posts are still up.",
        "caption": "NO TIES? · THEN vs. NOW"
      },
      "video": {
        "provider": "file",
        "id": "/fnn/clips/no-ties.mp4",
        "label": "Watch"
      }
    },
    {
      "slug": "revenge-agenda",
      "date": "2026-10-21",
      "section": "thenvsnow",
      "kicker": "THEN vs. NOW",
      "headline": "Every Accusation Is a Confession: Democrats Swore Off “Weaponizing” Government.",
      "headline_now": "Now They’re Writing the Subpoena List.",
      "deck": "Their words, with dates. We checked every one.",
      "byline": "By FNN Desk",
      "body": "Washington runs on one law: every accusation is a confession.\n\nFeb. 10: Sen. Elissa Slotkin said President Trump “continues to weaponize our justice system against his perceived enemies.”\n\nNine days later, Susan Rice, Obama’s national security adviser, laid out the plan: an “accountability agenda.” Companies had “better be ready for subpoenas.” She promised Democrats would “play by the law.” Then: “That also will be noted and remembered.”\n\nOct. 13, Slotkin, on young people weighing Trump administration jobs: “I want that deterrence message.”\n\nNoted. Remembered.",
      "pull_quote": "Every accusation is a confession. This time they read it into a microphone.",
      "then": {
        "text": "President Trump continues to weaponize our justice system against his perceived enemies.",
        "date": "2026-02-10",
        "source": "https://www.nbcnews.com/politics/trump-administration/doj-fails-secure-indictment-democrats-involved-illegal-orders-video-rcna258385",
        "source_name": "NBC News, quoting her post on X",